creationDate|id|locationIP|browserUsed|content|length
2012-09-25T20:55:32.321+00:00|1099511630191|31.170.121.115|Internet Explorer|About Slavoj Žižek, ty for Theoretical PsyAbout Sean Penn, He is a two-time AcadeAbout Denmark,  by Germany.|109
2012-09-25T14:21:35.728+00:00|1099511630248|31.170.121.115|Internet Explorer|About Marlene Dietrich, er. In 1999, the AAbout Slavoj Žižek, angerous politicalAbout Kurt Cobain,  Nirv|104
2012-09-25T16:03:55.032+00:00|1099511630317|31.185.10.92|Internet Explorer|roflol|6
2012-09-25T15:03:10.317+00:00|1099511630364|31.185.10.92|Internet Explorer|no way!|7
2012-09-25T16:58:25.120+00:00|1099511630368|31.185.10.92|Internet Explorer|About Spain under the Restoration, blic. After almost a whole century of political instability and many civil wars, the aim of the Restoration was to create a new polit|168
