creationDate|id|imageFile|locationIP|browserUsed|language|content|length|Forum.id
2012-09-16T05:47:23.180+00:00|1099511630457|""|27.112.88.106|Internet Explorer|uz|About Khalid Sheikh Mohammed, ged acts of terrorism, iAbout Margaret Thatcher, widely unpopu|92|962072674532
2012-09-16T09:12:08.180+00:00|1099511630480|""|197.220.203.36|Chrome|uz|About James Cameron, f all time at $2.16 billioAbout Khalid Sheikh Mohammed, nt in U.S. custody in Gua|102|962072674532
2012-09-16T04:22:38.180+00:00|1099511630496|""|31.24.100.159|Firefox|uz|About Khalid Sheikh Mohammed, g the September 11 attaAbout India, -classified into the tyAbout Feel Good Inc.,|111|962072674532
2012-09-16T09:17:23.180+00:00|1099511630509|""|193.104.227.215|Internet Explorer|uz|About Khalid Sheikh Mohammed,  terrorist group al-Qaeda organiAbout Off the Ground,  solo studi|95|962072674532
2012-09-16T05:18:08.180+00:00|1099511630532|""|115.186.113.189|Safari|uz|About Khalid Sheikh Mohammed, n Laden's terrorist grAbout Robert Plant, he 51st Grammy Awards.About Jackie|107|962072674532
2012-09-16T10:12:08.180+00:00|1099511630537|""|31.209.179.5|Firefox|uz|About Cleopatra VII, did learn to speak EgypAbout Khalid Sheikh Mohammed, ence agency of|88|962072674532
2012-09-16T13:51:08.180+00:00|1099511630544|""|196.29.42.107|Firefox|uz|About Khalid Sheikh Mohammed, ld Trade Center bombAbout Andrew Carnegie, 919) was a Scottish-Ab|95|962072674532
2012-09-16T12:08:23.180+00:00|1099511630550|""|41.223.177.12|Safari|uz|About Khalid Sheikh Mohammed, m, including mass mAbout Sarah Palin, tion in 2008, PalinAbou|91|962072674532
